카테고리,상품URL,이미지URL,문제텍스트,금칙어
슈즈,https://www.shoppingntmall.com/display/goods/12149472?dispCatSn=90000367,https://img.shoppingntmall.com/display/goods/detail/describe/12149472/proxy/src/https://img.shoppingntmall.com/htmleditor/329/noname%E3%85%87%E3%85%87%E3%84%B9%E3%84%B4%E3%84%B9%E3%84%B41701043788270.png/dims/crop/0x8400+0+8400/dims/strip/true/dims/crop/0x0+0+1200/optimize,"내피 : 졸디에스터 14050 / 승 : Boar  중국  XIAMEN UTRUST IMPORT AND EXPORT CO.,LTD.  모브인터네셔널  202214 11월  1년  (주)줌마케팅 02-2679-9698  1.통풍이 잘 되는 곳에 보관해주세요. 물에 젖었을 경우 마른 수건으로 YS 후 응달에서 말려주세요.",통풍
슈즈,https://www.shoppingntmall.com/display/goods/14171073?dispCatSn=90000367,https://img.shoppingntmall.com/display/goods/detail/describe/14171073/proxy/src/https://img.shoppingntmall.com/htmleditor/682/%EC%9B%B9%EA%B8%B0%EC%88%A0%EC%84%9C%20-%20%EC%96%B8%EB%B9%84%ED%8A%BC%20%EC%A3%BC%EC%96%BC%EC%B0%B8%20%ED%94%8C%EB%9E%AB%ED%8F%BC%20%ED%8D%BC%EC%8A%88%EC%A6%88%20%28%EB%A7%88%EC%8A%A4%ED%84%B0%29%20%EC%B7%A8%EA%B8%89%20%ED%8F%AC%ED%95%A81701757575194.jpg/dims/crop/0x8400+0+16800/dims/crop/0x0+0+2400/optimize,"ㅜ          세 허이 T OU, OC BN 총기 증시 이시고 Ce 통풍이 잘되는 그늘에 완전 건조 후, 사용해 주세요  2. 표백성분이 있는 세제 및 세탁기, 탈수기에  사용은 하지 말아 주시기 바랍니다.  4. 바닥장 미끄럼 완화 관련 부분은 오랜 기간 착화시, 니다.  은 Oy  면 또는 미끄러지기 쉬운 장소에서 착화시, 에 주의 바랍니다. (젖거나 얼은 노면, 맨홀 등)  는, 미돌  dk  레이터 BSA] 안전사고 예방을 위해 안에 위치해 주십시오  성일  는 신발을 착용할 경우, 찰과상이 발생할 및         시기 바랍니다.  140 Bl me | id S pad @ 4H  어린이는 부자재(주얼 장식, 참 등) 장식을 헌                    Beal",통풍
슈즈,https://www.shoppingntmall.com/display/goods/12155252?dispCatSn=90000367,https://img.shoppingntmall.com/display/goods/detail/describe/12155252/proxy/src/https://img.shoppingntmall.com/htmleditor/054/maydew_M_knitboots_21669939508421.jpg/dims/crop/0x0+0+7200/optimize,"시  s  우에는 교환/반품이 어려울 수 있습니다. 상품의 하자로 인한 교환 및 반품 AS 요청시 반드시 상품과 함께  요청 내용 메모를 동봉 해주시기 바랍니다.  방송된 상품이 회손된 경우 외부 착용 흔적, 세탁 혼적, 냄새가 My (담배 향수 음식 등) 상품 라벨이 떨어진 ASE 환불이 어려울수 있습!  니다.",담배
슈즈,https://www.shoppingntmall.com/display/goods/12149471?dispCatSn=90000367,https://img.shoppingntmall.com/display/goods/detail/describe/12149471/proxy/src/https://img.shoppingntmall.com/htmleditor/321/%EC%87%BC%ED%8B%B0%20ventfort_M_hightopsneakers_021672027397530.jpg/dims/crop/0x8400+0+8400/dims/crop/0x0+0+1200/optimize,"Je om  랙, 화이트  i  250 / 255 / 260 / 265 / 270 / 275 / 280 (5mm 편차)  사이즈 무게 : OF 3959 (260 SHY 기준) 갑피 : 합성가죽 소재              내피(『41) : 폴리에스터 100% 창 : 합성고무 제조국              중국 제조사              XIAMEN UTRUST IMPORT AND EXPORT CO.,LTD 수입원              모브인터네셔널 제조년월         2022년 11월  1년  051-913-2283  1.통풍이잘되 2",통풍
슈즈,https://www.shoppingntmall.com/display/goods/13771028?dispCatSn=90000367,https://img.shoppingntmall.com/display/goods/detail/describe/13771028/proxy/src/https://img.shoppingntmall.com/htmleditor/641/cosy%20comfort_41693184274509.jpg/dims/optimize,"INFO  상품명     소가죽 코지 컴포트 소 재    겹피 : 선연가죽(소가죽) 내피 : 폴리에스터100%, 합성가죽 아웃솔(창) : 폴리우레탄 곡옥     블랙, 브라운. 베이지, 보카, 와인 사이즈      225~255 mm (517머사이즈 간격 7개 사이즈) 굽높이    앞 2.5 007 / 뒤 5 00 (깔창포함) 무 게     195 g (225사이즈 1짝기준) 발 볼    7.701ㅠ0 (225사이즈기준) 제조사 _ (주) 거림산업 제조국     대한민국 주의사항 - 얼룩이 묻었을 경우, 천연가죽 갑피는 물티슈로 Al 마시고, 부드러운 솔이나 스폰지로 7H] 문질러 주세요. 장시간 물에 담가두거나 세탁기는 절대 사용하지 마세요.  4 - 적당한 온도와 습도에서 보관해 주세요.  겨 붙을 수 있으니 화기를 피해 주세요.",와인
슈즈,https://www.shoppingntmall.com/display/goods/12818779?dispCatSn=90000367,https://img.shoppingntmall.com/display/goods/detail/describe/12818779/proxy/src/https://img.shoppingntmall.com/htmleditor/646/ecoe_comfort_041679371713825.jpg/dims/optimize,"상품명            235/5 에코에 여성용 컴포트화 구성              여성 컴포트화 1종 색상              블랙, 골드베이지, 민트그린, 코랄핑크, 썸머레드  225 / 230/235 / 240/245 / 250 사이즈               굽높이 - 약 407 (인솔포함) 무게 - 약 1008 (235mm 반짝기준)  갑피 - 천연가죽(양가죽) 소재                  배색 - 합성가죽  창 - 합성고무 제조원              모브인터네셔널 제조국               대한민국 수입/판매원       쥐줌마케팅 제조년월             2023년 3월~ 연락처          쥐줌마케팅 02-2679-9698  ㆍ 통풍이잘 되는 곳에 보관해주세요.  ㆍ 물에젖었을경우마른수건으로다은후응달에서말려주세  요  ㆍ 날카로운 물질에 걸리거나 심하게 당을 경우 갑피 소재 의 끊어짐이나 늘어짐이 발생할 수 있으므로 사용시 주의 | 하시기바랍니다. ㆍ 고온의 물 또는 화기에 노출될 경우 갑피 및 겉창의 형태 a 변형되거나 훼손될 수 있습니다. 상기 제품 훼손의 경우 는 &/5규정에 해당하지 않습니다. 은 색상의 양말이나 스타킹을 신고 착용시 이염이 발  은 색상 수 있으니 주의하시기 바랍니다.  취급시 주의사항  밖: 러 생할",통풍
